{
    "module": "thinksuit/mu",
    "provider": "openai",
    "model": "gpt-5",
    "maxDepth": 5,
    "maxFanout": 3,
    "allowedTools": [
        "read_text_file", "read_media_file", "read_multiple_files",
        "list_directory"
    ],
    "allowedDirectories": [
        "/Users/mac/repos/github.com/machellerogden"
    ],
    "cwd": "/Users/mac/repos/github.com/machellerogden",
    "trace": false
}
